<?xml version="1.0" encoding="utf-8"?>
  <network xmlns="http://auto.tuwien.ac.at"
         xmlns:xsi="http://www.w3.org/2001/XMLSchema-instance"
         xsi:schemaLocation="http://auto.tuwien.ac.at schema.xsd"
         id="P-081A"
         name="Siemens_Koffer_IoTSyS"
         standard="KNX">
   <entities>
      <entity id="P-081A-0_DI-6"
              name="IP-Router N 146/02"
              description="Productinfo - see file:   1461ab02_tpi_e.pdf"
              orderNumber="5WG1 146-1AB02"
              manufacturerId="M-0001">
         <translations>
            <translation language="de-DE" attribute="name" value="IP-Router N 146/02"/>
            <translation language="de-DE"
                         attribute="description"
                         value="Produktinfo - siehe Datei:   1461ab02_tpi.pdf"/>
            <translation language="en-US" attribute="name" value="IP-Router N 146/02"/>
            <translation language="en-US"
                         attribute="description"
                         value="Productinfo - see file:   1461ab02_tpi_e.pdf"/>
         </translations>
      </entity>
      <entity id="P-081A-0_DI-2"
              name="FCU Operator Panel Office UP 237E DELTA i-system"
              orderNumber="5WG1 237-2EB_1"
              manufacturerId="M-0001">
         <translations>
            <translation language="de-DE"
                         attribute="name"
                         value="Bediengerät Büro UP 237E DELTA i-system"/>
            <translation language="en-US"
                         attribute="name"
                         value="FCU Operator Panel Office UP 237E DELTA i-system"/>
         </translations>
         <datapoints>
            <datapoint id="P-081A-0_DI-2_M-0001_A-8025-01-C29E_O-10_R-11"
                       name="Status of window"
                       description="1=open / 0=closed"
                       datapointTypeIds="DPST-1-9"
                       priority="Low"
                       writeFlag="Enabled"
                       communicationFlag="Enabled"
                       readFlag="Disabled"
                       readOnInitFlag="Disabled"
                       transmitFlag="Enabled"
                       updateFlag="Enabled">
               <translations>
                  <translation language="de-DE" attribute="name" value="Fensterstatus"/>
                  <translation language="de-DE"
                               attribute="description"
                               value="1=geöffnet / 0=geschlossen"/>
                  <translation language="en-US" attribute="name" value="Status of window"/>
                  <translation language="en-US" attribute="description" value="1=open / 0=closed"/>
               </translations>
            </datapoint>
            <datapoint id="P-081A-0_DI-2_M-0001_A-8025-01-C29E_O-9_R-10"
                       name="Fan rotational speed"
                       description="0% ... 100%"
                       datapointTypeIds="DPST-5-5"
                       priority="Low"
                       writeFlag="Disabled"
                       communicationFlag="Enabled"
                       readFlag="Disabled"
                       readOnInitFlag="Disabled"
                       transmitFlag="Enabled"
                       updateFlag="Disabled">
               <translations>
                  <translation language="de-DE" attribute="name" value="Ventilatordrehzahl"/>
                  <translation language="de-DE" attribute="description" value="0% ... 100%"/>
                  <translation language="en-US" attribute="name" value="Fan rotational speed"/>
                  <translation language="en-US" attribute="description" value="0% ... 100%"/>
               </translations>
            </datapoint>
            <datapoint id="P-081A-0_DI-2_M-0001_A-8025-01-C29E_O-8_R-9"
                       name="Fan status"
                       description="Automatic / manual mode"
                       datapointTypeIds="DPST-1-1"
                       priority="Low"
                       writeFlag="Enabled"
                       communicationFlag="Enabled"
                       readFlag="Disabled"
                       readOnInitFlag="Disabled"
                       transmitFlag="Enabled"
                       updateFlag="Enabled">
               <translations>
                  <translation language="de-DE" attribute="name" value="Ventilator-Status"/>
                  <translation language="de-DE"
                               attribute="description"
                               value="Automatik- /Handbetrieb"/>
                  <translation language="en-US" attribute="name" value="Fan status"/>
                  <translation language="en-US"
                               attribute="description"
                               value="Automatic / manual mode"/>
               </translations>
            </datapoint>
            <datapoint id="P-081A-0_DI-2_M-0001_A-8025-01-C29E_O-7_R-8"
                       name="Fan automatic mode"
                       description="On / Off"
                       datapointTypeIds="DPST-1-1"
                       priority="Low"
                       writeFlag="Disabled"
                       communicationFlag="Enabled"
                       readFlag="Disabled"
                       readOnInitFlag="Disabled"
                       transmitFlag="Enabled"
                       updateFlag="Disabled">
               <translations>
                  <translation language="de-DE"
                               attribute="name"
                               value="Ventilator Automatikbetrieb"/>
                  <translation language="de-DE" attribute="description" value="Ein / Aus"/>
                  <translation language="en-US" attribute="name" value="Fan automatic mode"/>
                  <translation language="en-US" attribute="description" value="On / Off"/>
               </translations>
            </datapoint>
            <datapoint id="P-081A-0_DI-2_M-0001_A-8025-01-C29E_O-6_R-7"
                       name="Frost/heat protection"
                       description="On / Off"
                       datapointTypeIds="DPST-1-1"
                       priority="Low"
                       writeFlag="Enabled"
                       communicationFlag="Enabled"
                       readFlag="Disabled"
                       readOnInitFlag="Disabled"
                       transmitFlag="Enabled"
                       updateFlag="Enabled">
               <translations>
                  <translation language="de-DE"
                               attribute="name"
                               value="Frost-/ Hitzeschutzbetrieb"/>
                  <translation language="de-DE" attribute="description" value="Ein / Aus"/>
                  <translation language="en-US" attribute="name" value="Frost/heat protection"/>
                  <translation language="en-US" attribute="description" value="On / Off"/>
               </translations>
            </datapoint>
            <datapoint id="P-081A-0_DI-2_M-0001_A-8025-01-C29E_O-5_R-6"
                       name="Night mode"
                       description="On / Off"
                       datapointTypeIds="DPST-1-1"
                       priority="Low"
                       writeFlag="Enabled"
                       communicationFlag="Enabled"
                       readFlag="Disabled"
                       readOnInitFlag="Disabled"
                       transmitFlag="Enabled"
                       updateFlag="Enabled">
               <translations>
                  <translation language="de-DE" attribute="name" value="Nachtbetrieb"/>
                  <translation language="de-DE" attribute="description" value="Ein / Aus"/>
                  <translation language="en-US" attribute="name" value="Night mode"/>
                  <translation language="en-US" attribute="description" value="On / Off"/>
               </translations>
            </datapoint>
            <datapoint id="P-081A-0_DI-2_M-0001_A-8025-01-C29E_O-4_R-5"
                       name="Standby mode"
                       description="On / Off"
                       datapointTypeIds="DPST-1-1"
                       priority="Low"
                       writeFlag="Enabled"
                       communicationFlag="Enabled"
                       readFlag="Disabled"
                       readOnInitFlag="Disabled"
                       transmitFlag="Enabled"
                       updateFlag="Enabled">
               <translations>
                  <translation language="de-DE" attribute="name" value="Standbybetrieb"/>
                  <translation language="de-DE" attribute="description" value="Ein / Aus"/>
                  <translation language="en-US" attribute="name" value="Standby mode"/>
                  <translation language="en-US" attribute="description" value="On / Off"/>
               </translations>
            </datapoint>
            <datapoint id="P-081A-0_DI-2_M-0001_A-8025-01-C29E_O-3_R-4"
                       name="Status of comfort mode"
                       description="On / Off"
                       datapointTypeIds="DPST-1-1"
                       priority="Low"
                       writeFlag="Enabled"
                       communicationFlag="Enabled"
                       readFlag="Disabled"
                       readOnInitFlag="Disabled"
                       transmitFlag="Enabled"
                       updateFlag="Enabled">
               <translations>
                  <translation language="de-DE" attribute="name" value="Status Komfortbetrieb"/>
                  <translation language="de-DE" attribute="description" value="Ein / Aus"/>
                  <translation language="en-US" attribute="name" value="Status of comfort mode"/>
                  <translation language="en-US" attribute="description" value="On / Off"/>
               </translations>